{
  "$schema": "../schema/queue-item.schema.json",
  "acceptanceCriteria": [
    "AC-01",
    "AC-02",
    "AC-03",
    "AC-04",
    "AC-05",
    "AC-06"
  ],
  "completion": {
    "agentId": "controller-direct",
    "completedAt": "2026-09-22T06:20:58.563136Z",
    "evidence": [
      "python3 scripts/validate_agent_governance.py: PASS (25 required paths, 40 markdown files, JSON valid, skill frontmatter valid, links valid, queue valid)",
      "python3 -m unittest discover -s tests -v: PASS (54/54, unchanged - confirms Lean helper scripts untouched)",
      "python3 scripts/agent_queue.py validate: PASS (1 item, 0 errors)",
      "manual: no code/tests reference agent-models.json or hardcoded model IDs (grep-confirmed before edit); registry role floors hand-verified to resolve to the documented mapping",
      "manual: prepare-dispatch/validate-dispatch fictional CLI references corrected in both agent-topology.md and execution-router.md; remaining grep hits are the corrected explanatory text only"
    ]
  },
  "createdAt": "2026-09-22T06:16:48.662155Z",
  "dependencies": [],
  "doNotTouch": [
    "scripts/*.py",
    "tests/*.py"
  ],
  "exclusiveScopes": [
    "docs:agent-governance"
  ],
  "id": "Q0001",
  "objective": "Replace flat role->model mapping with capability-vector registry selection and merge V3.1 policy concepts into agent-topology.md",
  "primaryFiles": [
    ".claude/rules/agent-topology.md",
    ".claude/runtime/agent-models.json",
    ".claude/agents/request-evaluator.md",
    ".claude/agents/planner.md",
    ".claude/agents/worker.md",
    ".claude/agents/simple-worker.md",
    ".claude/agents/lead-reviewer.md",
    "docs/tracking/TEMPLATE.md",
    ".claude/rules/tracking.md"
  ],
  "priority": 10,
  "relevantRules": [],
  "requiredCapabilities": [
    "docs"
  ],
  "requiredValidation": [
    "python3 scripts/validate_agent_governance.py",
    "python3 -m unittest discover -s tests -v",
    "python3 scripts/agent_queue.py validate"
  ],
  "stateHistory": [
    {
      "agentId": "controller-direct",
      "at": "2026-09-22T06:20:58.563136Z",
      "event": "completed"
    }
  ],
  "status": "DONE",
  "task": "TASK-001",
  "title": "Merge V3.1 capability-vector topology into agent-topology.md + registry + role frontmatter",
  "updatedAt": "2026-09-22T06:20:58.563136Z",
  "workset": "TCK001"
}
